{"$schema": "http://json-schema.org/draft-04/schema#","type": "object","properties":{"Jobs":{"type": "array","properties":{"company": {"type": "string"},"description": {"type": "string"},"start_date": {"type": "string"},"end_date": {"type": "string"},"title": {"type": "string"}}},"Name": {"type": "object","properties":{"middle": {"type": "string"},"last": {"type": "string"},"First": {"type": "string"}}},"summary":{"type": "string"},"Connections": {"type": "string"},"specialties": {"type": "string"},"image_url": {"type": "string"},"Location": {"type": "object","properties":{"country": {"type": "string"},"state": {"type": "string"},"city": {"type": "string"}}},"Recommendations": {"type": "string"},"profile_url": {"type": "string"}}}