{"Jobs": [], "Name": {"middle": "", "last": "Mukuddem", "First": "Mukhtar"}, "summary": "", "Connections": "1", "specialties": "", "image_url": "", "Location": {"country": "ZA", "state": "GP", "city": "Johannesburg"}, "Recommendations": "", "profile_url": "https://www.linkedin.com/reg/join-pprofile?_ed=0_dHB8G4tKSI1eNkyEd3uBk2dzQE2AkVU1r9kHbXjxPZGWJlD5Jt4ZMf87SacJnJbVKfc0K81v-OOraoO47iCXB2kwI1nPbtsTxaxXzOc3BKm&trk=pprof-0-ts-view_full-0"}