{"Jobs": [], "Name": {"middle": "", "last": "Kaas", "First": "Kristina"}, "summary": "", "Connections": "1", "specialties": "", "image_url": "", "Location": {"country": "SE", "state": "Stockholm County", "city": "Stockholm"}, "Recommendations": "", "profile_url": "https://www.linkedin.com/reg/join-pprofile?_ed=0_dHB8G4tKSI1eNkyEd3uBk2dzQE2AkVU1r9kHbXjxPZGWJlD5Jt4ZMf87SacJnJbVB7OZYEmp36CoL2vHSpOzk0PjDypYHoBIETNmtA9h1Cp&trk=pprof-0-ts-view_full-0"}