{"Jobs": [], "Name": {"middle": "", "last": "Kittles", "First": "Oshanda"}, "summary": "", "Connections": "2", "specialties": "", "image_url": "", "Location": {"country": "US", "state": "GA", "city": "Atlanta"}, "Recommendations": "", "profile_url": "https://www.linkedin.com/reg/join-pprofile?_ed=0_dHB8G4tKSI1eNkyEd3uBk2dzQE2AkVU1r9kHbXjxPZGWJlD5Jt4ZMf87SacJnJbVDTY9fXzs1WDuJL1smb9PRQGzNuIYMH4XhjHgwxGZnGo&trk=pprof-0-ts-view_full-0"}