{"Jobs": [], "Name": {"middle": "", "last": "Bennett", "First": "Tim"}, "summary": "", "Connections": "1", "specialties": "", "image_url": "", "Location": {"country": "US", "state": "GA", "city": "Atlanta"}, "Recommendations": "", "profile_url": "https://www.linkedin.com/reg/join-pprofile?_ed=0_dHB8G4tKSI1eNkyEd3uBk2dzQE2AkVU1r9kHbXjxPZGWJlD5Jt4ZMf87SacJnJbVFzdc9iWI7E3UXzK_c18tJIyaQJ6vo6fwpwKvsHyBszn&trk=pprof-0-ts-view_full-0"}