{"Jobs": [], "Name": {"middle": "", "last": "Kingsbury", "First": "Karen"}, "summary": "", "Connections": "45", "specialties": "", "image_url": "", "Location": {"country": "US", "state": "MA", "city": ""}, "Recommendations": "", "profile_url": "https://www.linkedin.com/reg/join-pprofile?_ed=0_dHB8G4tKSI1eNkyEd3uBk2dzQE2AkVU1r9kHbXjxPZGWJlD5Jt4ZMf87SacJnJbVDIMdAVGpVvjte2IEy7NmEW9ZxnWXTOR2pm74XZ0IWGi&trk=pprof-0-ts-view_full-0"}