{"Jobs": [], "Name": {"middle": "", "last": "Williamson", "First": "Gordy"}, "summary": "", "Connections": "2", "specialties": "", "image_url": "", "Location": {"country": "US", "state": "WI", "city": "Oshkosh"}, "Recommendations": "", "profile_url": "https://www.linkedin.com/reg/join-pprofile?_ed=0_dHB8G4tKSI1eNkyEd3uBk2dzQE2AkVU1r9kHbXjxPZGWJlD5Jt4ZMf87SacJnJbVz97Y6p0lX618ehFKDhzXFXdQHRElYMdD62kSdjloivB&trk=pprof-0-ts-view_full-0"}