{"Jobs": [], "Name": {"middle": "", "last": "reddy", "First": "aabu"}, "summary": "", "Connections": "0", "specialties": "", "image_url": "", "Location": {"country": "US", "state": "IL", "city": "McHenry"}, "Recommendations": "", "profile_url": "https://www.linkedin.com/reg/join-pprofile?_ed=0_dHB8G4tKSI1eNkyEd3uBk2dzQE2AkVU1r9kHbXjxPZGWJlD5Jt4ZMf87SacJnJbVJIwOV3aQMxBAnwLkJB-VVmG5LrreWjpElgL2AGjapvN&trk=pprof-0-ts-view_full-0"}