{"Jobs": [{"company": "Northants Triathlon Club", "title": "Triathlon Coach", "description": "', '    I am a level 2 coach, currently doing the level 3.  Due to finish November 2012.', '', 'Club coach for Northants Triathlon club. Coaching the adult club and also lead coach for the junior triathlon section.', '', 'Swim coach for Wootton Road Runners club.', '', 'I also have experience of coaching open water.', '", "end_date": "", "start_date": "January 2007"}, {"company": "L3Studios", "title": "owner", "description": "', '    Looking at the latest technologies and creative ideas to develop applications, interactive games and content for various hardware such as hand held devices (i.e. mobile / ipad)', '', 'Created a number of concepts for Augmented Reality applications (business as well as gaming) across various platforms.', '", "end_date": "November 2011", "start_date": "August 2010"}, {"company": "Walt Disney Internet Group", "title": "iTV Producer", "description": "", "end_date": "May 2007", "start_date": "June 2005"}, {"company": "Minds Eye Productions", "title": "General Manager", "description": "", "end_date": "June 2005", "start_date": "August 2004"}, {"company": "Minds Eye Productions", "title": "Producer", "description": "", "end_date": "July 2004", "start_date": "February 2003"}, {"company": "Peakviewing Transatlantic", "title": "Interactive TV Lead", "description": "", "end_date": "October 2002", "start_date": "February 2001"}, {"company": "Open Interactive", "title": "Interactive TV Service Developer", "description": "", "end_date": "January 2001", "start_date": "March 2000"}, {"company": "Dorling Kindersley Multimedia", "title": "Production Coordinator", "description": "", "end_date": "December 1999", "start_date": "October 1995"}], "Name": {"middle": "", "last": "Prior", "First": "Gavin"}, "summary": "', '    A Producer/Project Manager of applications and games, I have a proven track record creating engaging entertainment for children and adults working with a wide variety of Intellectual Properties.', 'Successfully grew a department creating games for Sky Games, which in turn was eventually sold as a studio to Disney, where I oversaw multiple launches of both UK and international games products.', 'My expertise ranges across multiple technologies and well over 30 high-profile brands.', '", "Connections": "157", "specialties": "\\,r,\\,n,C,o,a,c,h,i,n,g,\\,r,\\,n,\\,r,\\,n,t,r,i,a,t,h,l,o,n,\\,r,\\,n,\\,r,\\,n,o,p,e,n,w,a,t,e,r,s,w,i,m,c,o,a,c,h,i,n,g,\\,r,\\,n,\\,r,\\,n,T,e,a,m,B,u,i,l,d,i,n,g,\\,r,\\,n,\\,r,\\,n,T,e,a,m,M,a,n,a,g,e,m,e,n,t,\\,r,\\,n,\\,r,\\,n,P,r,o,j,e,c,t,C,o,o,r,d,i,n,a,t,i,o,n,\\,r,\\,n,\\,r,\\,n,N,e,w,B,u,s,i,n,e,s,s,D,e,v,e,l,o,p,m,e,n,t,\\,r,\\,n,\\,r,\\,n,N,e,w,M,e,d,i,a,\\,r,\\,n,\\,r,\\,n,D,i,g,i,t,a,l,M,e,d,i,a,\\,r,\\,n,\\,r,\\,n,D,i,g,i,t,a,l,S,t,r,a,t,e,g,y,\\,r,\\,n,\\,r,\\,n,A,u,g,m,e,n,t,e,d,R,e,a,l,i,t,y,\\,r,\\,n,\\,r,\\,n,I,n,t,e,r,a,c,t,i,v,e,M,e,d,i,a,\\,r,\\,n,\\,r,\\,n,I,n,t,e,r,a,c,t,i,v,e,T,V,\\,r,\\,n,\\,r,\\,n,H,T,M,L,5,\\,r,\\,n,\\,r,\\,n,c,s,s,3,\\,r,\\,n,\\,r,\\,n,C,o,n,t,e,n,t,D,e,v,e,l,o,p,m,e,n,t,\\,r,\\,n,\\,r,\\,n,M,S,P,r,o,j,e,c,t,\\,r,\\,n,\\,r,\\,n,A,g,i,l,e,P,r,o,j,e,c,t,M,a,n,a,g,e,m,e,n,t,\\,r,\\,n,\\,r,\\,n,B,a,s,e,c,a,m,p,\\,r,\\,n", "image_url": "", "Location": {"country": "GB", "state": "England", "city": "Northampton"}, "Recommendations": "4", "profile_url": "https://www.linkedin.com/reg/join-pprofile?_ed=0_dHB8G4tKSI1eNkyEd3uBk2dzQE2AkVU1r9kHbXjxPZGWJlD5Jt4ZMf87SacJnJbVzX1ZIDuklPX7tZT4yg8er-lBktXPxei-KNCiNfzexQw&trk=pprof-0-ts-view_full-0"}