{"Jobs": [{"company": "Command Strategies", "title": "Senior Consultant", "description": "', 'Consulting in Business Development with a focus on the Federal Marketplace.', '", "end_date": "", "start_date": "January 2011"}], "Name": {"middle": "", "last": "Hutton", "First": "Dave"}, "summary": "", "Connections": "321", "specialties": "\\,r,\\,n,N,e,w,B,u,s,i,n,e,s,s,D,e,v,e,l,o,p,m,e,n,t,\\,r,\\,n,\\,r,\\,n,O,p,e,r,a,t,i,o,n,s,M,a,n,a,g,e,m,e,n,t,\\,r,\\,n,\\,r,\\,n,g,e,n,e,r,a,l,m,a,n,a,g,e,m,e,n,t,\\,r,\\,n,\\,r,\\,n,D,o,D,\\,r,\\,n,\\,r,\\,n,N,a,v,y,\\,r,\\,n,\\,r,\\,n,D,e,f,e,n,s,e,\\,r,\\,n,\\,r,\\,n,M,i,l,i,t,a,r,y,\\,r,\\,n,\\,r,\\,n,O,r,g,a,n,i,z,a,t,i,o,n,a,l,L,e,a,d,e,r,s,h,i,p,\\,r,\\,n,\\,r,\\,n,G,o,v,e,r,n,m,e,n,t,\\,r,\\,n", "image_url": "http://m3.licdn.com/mpr/pub/image-aA4wIIACGy7nGsOfSa6CCDI-wYJWzHOE7AehC7sCwwJcQoeraA4hmA4CwzgwQehjjVVe/dave-hutton.jpg", "Location": {"country": "US", "state": "MN", "city": "Minneapolis"}, "Recommendations": "", "profile_url": "https://www.linkedin.com/reg/join-pprofile?_ed=0_dHB8G4tKSI1eNkyEd3uBk2dzQE2AkVU1r9kHbXjxPZGWJlD5Jt4ZMf87SacJnJbVI1bUiPjXH62l4gT-CkzZRQOF_KoSg9neWJc_XY25yxM&trk=pprof-0-ts-view_full-0"}