{"Jobs": [{"company": "Hobbs Ltd", "title": "Business Analyst", "description": "", "end_date": "", "start_date": "September 2012"}, {"company": "Projmbiza Ltd", "title": "Owner and Director", "description": "', 'Projmbiza ltd offers both project management and business analysis services. Experience in Online Gaming, Retail eCommerce, Aviation, Media sectors.', '", "end_date": "", "start_date": "May 2010"}, {"company": "Tesco.com", "title": "Business Analyst", "description": "', 'Working on creating new strategic API (initial focus on mobile, grocery, non-grocery and clubcard):', \"analysing existing API's and Operations\", 'fitting these into new Enterprise model', \"writing IDL's (interface description language) documents for developers\", 'creating new processes where necessary', '", "end_date": "August 2012", "start_date": "May 2012"}, {"company": "Tigerspike", "title": "Digital Project Manager/Business Analyst", "description": "', 'Tigerspike are a technology company with a range of professional services who specialise in Personal Media (ipad, iphone, android).', '', 'technologies on project:', '.net, JSON, xcode, XML', '", "end_date": "May 2012", "start_date": "January 2012"}, {"company": "Easyjet", "title": "Business Analyst", "description": "', 'Working on Mobile and Desktop product relating to passenger checkin, bag drop etc.', '", "end_date": "January 2012", "start_date": "June 2011"}, {"company": "Motability Operations", "title": "Business Analyst", "description": "', \"Business Analyst focussing on changes to MO's core Dealership platform.\", '", "end_date": "June 2011", "start_date": "January 2011"}, {"company": "Salmon", "title": "Business Analyst", "description": "', \"I worked on Salmon's Argos account, creating functional specifications.\", '", "end_date": "November 2010", "start_date": "September 2010"}, {"company": "Blacks Leisure Group", "title": "Business Analyst", "description": "', 'Analysed Business Intelligence (Boxi) reporting requirements across multiple departments (Finance, Buying and Merchandising and Online/Internet etC), specifically identifying data elements that are missing from existing reports. I also created documentation on existing reporting processes to identify areas of improvement.', '", "end_date": "September 2010", "start_date": "April 2010"}, {"company": "LVS", "title": "Business Analyst/Documentation Manager", "description": "', \"Business Analyst on 2 major projects: 'Live Betting' and 'Affiliate Systems'.\", 'Author of EGP (Enterprise Gaming Platform) product user guide, CMS user guide and all release notes using JIRA. ', 'Documentation Manager - responsible for end user and technical documentation.', '", "end_date": "April 2010", "start_date": "February 2009"}, {"company": "Cloudcity", "title": "Head of Project Services", "description": "', 'ASP.net, c#, sql server development environment.', 'My primary focus was to improve Project communication between project team members and to introduce the Project Management discipline to the organisation, both of which were achieved. Cloudcity produce white labelled online trivia games which can be branded according to individual business alliance requirements and these games are used as a viral marketing tool. Cloudcity also have their own core product set which to date includes Football Trivia, Movie Trivia and Sci-Fi Trivia. ', '', 'The primary Project Management methodology used at Cloudcity was based on Agile development using SCRUM. I also introduced elements of the Waterfall approach to Project Management where applicable for example issue and risk logs.', '", "end_date": "August 2008", "start_date": "November 2007"}, {"company": "Ladbrokes eGaming", "title": "eCommerce Project Manager", "description": "', 'Project Manager on large ecommerce systems within a matrix management organisation.', 'Responsible for implementation of Online Payment Solutions (Alternative Payment Methods such as Neteller, Earthport, eNets, Entropay, 1-Pay as well as the Datacash payment gateway from Ladbrokes) for 2.5 years. ', 'Responsible for leading and managing the implementation of an IT Governance Product - Mercury ITG - (Demand Management, Project Management, Programme Management, Resource Management) for 2.5 years. Responsible for process analysis, process design, process development, dashboard development, product training, product support. Developed processes for Systems Change Requests, Small/Medium/Large Project requests, Bug, Issue and Scope Change requests.', '", "end_date": "November 2007", "start_date": "July 2002"}, {"company": "Kana", "title": "Technical Support Consultant", "description": "', \"Responsible for resolving customer issues with Kana's online marketing product. Required Oracle, Solaris technical skills to resolve issues as well as good product knowledge and industry sector knowledge.\", '", "end_date": "2002", "start_date": "2000"}, {"company": "CSF", "title": "Oracle Pre-Sales Consultant", "description": "', 'Onsite consultancy role, assisting Sales team with technical demonstration of Oracle plug-in to BMC Patrol.', '", "end_date": "2000", "start_date": "1999"}, {"company": "Lillywhites", "title": "Oracle DBA/Unix Systems Administrator", "description": "', 'Specialist Sports retail in Piccadily, London.', 'Lillywhites was sold to Sports Direct.com in 2002.', '", "end_date": "1999", "start_date": "1998"}], "Name": {"middle": "", "last": "Lester", "First": "Gary"}, "summary": "', '- Experience Business Analyst (10 years)', '- Experience Project Manager (7 years)', '- PRINCE2 Practitioner ', '- ISEB Certificate in Project Management', '- 3 years SCRUM experience', '- In the Online Gaming Industry for 6 years and have since been in the Retail, Insurance, Airline and most recently iPad/iPhone development industries', '', 'Current project:', '- Definition of the programming methods (Operations) needed for a new strategic Tesco API ', '- Definition of the user stories and acceptance criteria', '', 'In Past:', 'Tigerspike - Project Manager for Haaretz Newspaper (Israeli) iPad Application', \"Tigerspike - Project Manager for Random House's client iPhone Application (Yotam Ottolenghi - chef)\", '', '- Easyjet - new checkin system', '- Enhancements to Online Vehicle Purchase web based system at Motability Operations', '- Data Warehouse Project - BI reporting requirements (Boxi) ', \"- Live Betting and Affiliate System for France's National Lottery provider.\", '- Administrator and Developer of Mercury ITG (Project and Portfolio Management System) system for Ladbrokes eGaming.', '- Online Payments, CRM, Sports Retail and Pre-Sales Consultancy.', '", "Connections": "500+", "specialties": "\\,r,\\,n,P,r,o,j,e,c,t,P,o,r,t,f,o,l,i,o,M,a,n,a,g,e,m,e,n,t,\\,r,\\,n,\\,r,\\,n,S,h,a,r,e,P,o,i,n,t,\\,r,\\,n,\\,r,\\,n,O,n,l,i,n,e,A,d,v,e,r,t,i,s,i,n,g,\\,r,\\,n,\\,r,\\,n,S,E,O,\\,r,\\,n,\\,r,\\,n,D,a,t,a,b,a,s,e,s,\\,r,\\,n,\\,r,\\,n,A,i,r,l,i,n,e,s,\\,r,\\,n,\\,r,\\,n,B,u,s,i,n,e,s,s,A,n,a,l,y,s,i,s,\\,r,\\,n,\\,r,\\,n,P,R,I,N,C,E,2,\\,r,\\,n,\\,r,\\,n,A,g,i,l,e,M,e,t,h,o,d,o,l,o,g,i,e,s,\\,r,\\,n,\\,r,\\,n,E,-,c,o,m,m,e,r,c,e,\\,r,\\,n,\\,r,\\,n,A,g,i,l,e,P,r,o,j,e,c,t,M,a,n,a,g,e,m,e,n,t,\\,r,\\,n,\\,r,\\,n,S,c,r,u,m,\\,r,\\,n", "image_url": "http://m3.licdn.com/mpr/pub/image-vpH7qZpBGzmofyHdPvfhwR0xwJrrps3WkCHCw09Ew6xK0G_WvpHCYplBwywfpeWPwIgz/gary-lester.jpg", "Location": {"country": "GB", "state": "England", "city": "London"}, "Recommendations": "22", "profile_url": "https://www.linkedin.com/reg/join-pprofile?_ed=0_dHB8G4tKSI1eNkyEd3uBk2dzQE2AkVU1r9kHbXjxPZGWJlD5Jt4ZMf87SacJnJbVFXOXkK96abRl3clqxHt8153DMKfKwyUFdSNX48K2fj7&trk=pprof-0-ts-view_full-0"}