{"Jobs": [{"company": "Imola Informatica", "title": "Senior Manager", "description": "", "end_date": "", "start_date": "January 2010"}, {"company": "Gruppo Imola", "title": "Technical  Sales Manager", "description": "", "end_date": "June 2011", "start_date": "October 2004"}, {"company": "Borland Software Corporation", "title": "Professional Solutions Manager", "description": "", "end_date": "September 2004", "start_date": "June 2000"}], "Name": {"middle": "Mauro", "last": "Vignati", "First": "Pier Mauro"}, "summary": "", "Connections": "197", "specialties": "", "image_url": "", "Location": {"country": "IT", "state": "Lombardia", "city": "Area Industriale"}, "Recommendations": "1", "profile_url": "https://www.linkedin.com/reg/join-pprofile?_ed=0_dHB8G4tKSI1eNkyEd3uBk2dzQE2AkVU1r9kHbXjxPZGWJlD5Jt4ZMf87SacJnJbVzDDXys_YcEbGsmB256bYjgXRxxoC93am7P1ZMMHF4TV&trk=pprof-0-ts-view_full-0"}