{"Jobs": [{"company": "TAL Direct", "title": "Senior Software Developer", "description": "', 'TAL Direct is the leading direct insurance provider in Australia. It operates the InsuranceLine brand and numerous \"white label\" alliances producing life insurance products and services for businesses such as Virgin Money, NIB and IAG.', '', 'As a senior developer, my role includes software design, implementation and support for insurance products on the in-house sales and admin system, and the customer-facing website. Software is developed in an Agile environment using TDD.', '', 'The technologies utilised include C#, VB.NET, ASP.NET, SQL Server 2008, T-SQL, MSMQ, WCF, RESTful web services, Linq2SQL, DevExpress, NUnit, Rhinomocks, Specflow, Project White, CruiseControl and TeamCity.', '", "end_date": "", "start_date": "July 2011"}, {"company": "Department of Employment, Economic Development and Innovation", "title": ".NET Consultant", "description": "', 'Short-term contract to implement a system for classifying and tracking scientific samples, with a tight deadline and a rapidly assembled team of 3 consultants. We utilised the Scrum Agile methodology to implement the most important system components first, empowering us to deliver a working product within 4 weeks.', '', 'My role involved business analysis, story breakdown, system architecture and software development. We built the system using C#, ASP.NET, SQL Server 2008, WCF, Linq2SQL and NUnit for TDD.', '", "end_date": "July 2011", "start_date": "June 2011"}, {"company": "BNP Paribas", "title": "Strategic Developer", "description": "', 'BNP Paribas is one of the largest banks in the world, measured by total assets. As a strategic developer my role involved system architecture, business analysis, development and support for a range of Product Control and Financial Control / Middle Office applications.', '', 'The overall system consisted of a number of SQL Server 2000 & 2008 databases, C# WPF GUI, MQ feed, and legacy MSAccess databases.', '", "end_date": "September 2010", "start_date": "September 2009"}, {"company": "Pioneer Alternative Investments", "title": "Senior Systems Developer", "description": "', 'PAI is a fund of hedge funds and one of the leading companies in the alternative investments arena. Momentus is PAI\u2019s front office system, providing functionality for research and quantitative analysis, portfolio construction, investment management and reporting.', '', 'As a senior developer on the Momentus team and as one of a team of four, I was responsible for business analysis, system architecture, development and support. The system consisted of C# MVP Winforms and C# ASP.NET front ends, C# .NET remoting mid-tier, SQL Server 2000 database, Sharepoint 2003 and Reporting Services 2000.', '", "end_date": "September 2009", "start_date": "May 2008"}, {"company": "ABN Amro", "title": "Analyst Developer", "description": "', 'Osiris is a pricing, booking and risk management system for exotic interest rate derivatives. The system incorporates extensive use of distributed components and parallel processing, using a DataSynapse GridServer for complex pricing and risk sensitivity calculations and simulations.', '', 'As a senior developer on the Osiris team, I was responsible for reengineering the overnight pricing and risk system, migrating overnight risk reports to the GridServer framework and implementing a large number of features, bug fixes and utilities.', '", "end_date": "April 2008", "start_date": "April 2006"}, {"company": "BBC Technology", "title": "IT Systems Development Engineer", "description": "', 'Project Jupiter was the first project in the world to fully digitalise the newsroom environment. The system utilises a digital core of media servers to produce a tape-less production environment. This empowers editors and journalists to access, distribute and archive media from their desktop ingestion from satellite feed or tape.', '', 'As a core developer on the team I was involved at all stages of the project lifecycle, from requirement specification and design through to implementation, testing, bug fixing and performance improvements.', '", "end_date": "March 2006", "start_date": "April 2003"}, {"company": "B+W Electronic Systems (now Ryco)", "title": "Lead Applications Developer", "description": "', 'As a senior developer working in this rapidly growing telecommunications company (winner of the Deloitte and Touche Fast50 Award as one of the fastest growing companies in the UK and in the top 100 in Europe) I successfully developed critical applications that are currently in use throughout the world.', '", "end_date": "March 2003", "start_date": "May 1999"}], "Name": {"middle": "", "last": "Burns", "First": "Brendan"}, "summary": "', 'A pragmatic, creative and team-oriented software engineer with an excellent attitude and communication skills, backed up by extensive development experience and solid academic qualifications.', '", "Connections": "431", "specialties": "\\,r,\\,n,C,o,n,t,i,n,u,o,u,s,I,n,t,e,g,r,a,t,i,o,n,\\,r,\\,n,\\,r,\\,n,A,g,i,l,e,M,e,t,h,o,d,o,l,o,g,i,e,s,\\,r,\\,n,\\,r,\\,n,C,#,\\,r,\\,n,\\,r,\\,n,J,S,P,\\,r,\\,n,\\,r,\\,n,S,o,f,t,w,a,r,e,D,e,v,e,l,o,p,m,e,n,t,\\,r,\\,n,\\,r,\\,n,M,i,c,r,o,s,o,f,t,S,Q,L,S,e,r,v,e,r,\\,r,\\,n,\\,r,\\,n,T,D,D,\\,r,\\,n,\\,r,\\,n,.,N,E,T,\\,r,\\,n,\\,r,\\,n,S,Q,L,\\,r,\\,n,\\,r,\\,n,W,C,F,\\,r,\\,n,\\,r,\\,n,S,c,r,u,m,\\,r,\\,n,\\,r,\\,n,A,S,P,.,N,E,T,\\,r,\\,n,\\,r,\\,n,W,P,F,\\,r,\\,n,\\,r,\\,n,W,i,n,F,o,r,m,s,\\,r,\\,n,\\,r,\\,n,D,e,s,i,g,n,P,a,t,t,e,r,n,s,\\,r,\\,n,\\,r,\\,n,A,g,i,l,e,P,r,o,j,e,c,t,M,a,n,a,g,e,m,e,n,t,\\,r,\\,n,\\,r,\\,n,R,e,q,u,i,r,e,m,e,n,t,s,A,n,a,l,y,s,i,s,\\,r,\\,n,\\,r,\\,n,B,u,s,i,n,e,s,s,A,n,a,l,y,s,i,s,\\,r,\\,n,\\,r,\\,n,V,B,.,N,E,T,\\,r,\\,n,\\,r,\\,n,L,I,N,Q,\\,r,\\,n,\\,r,\\,n,A,p,p,l,i,c,a,t,i,o,n,A,r,c,h,i,t,e,c,t,u,r,e,\\,r,\\,n,\\,r,\\,n,S,o,l,u,t,i,o,n,A,r,c,h,i,t,e,c,t,u,r,e,\\,r,\\,n,\\,r,\\,n,S,u,b,v,e,r,s,i,o,n,\\,r,\\,n,\\,r,\\,n,O,r,a,c,l,e,\\,r,\\,n,\\,r,\\,n,T,-,S,Q,L,\\,r,\\,n,\\,r,\\,n,J,a,v,a,\\,r,\\,n,\\,r,\\,n,W,e,b,S,e,r,v,i,c,e,s,\\,r,\\,n,\\,r,\\,n,V,i,s,u,a,l,S,t,u,d,i,o,\\,r,\\,n,\\,r,\\,n,M,u,l,t,i,t,h,r,e,a,d,i,n,g,\\,r,\\,n,\\,r,\\,n,O,b,j,e,c,t,O,r,i,e,n,t,e,d,D,e,s,i,g,n,\\,r,\\,n,\\,r,\\,n,D,a,t,a,b,a,s,e,D,e,s,i,g,n,\\,r,\\,n,\\,r,\\,n,C,r,u,i,s,e,C,o,n,t,r,o,l,\\,r,\\,n,\\,r,\\,n,S,y,s,t,e,m,A,r,c,h,i,t,e,c,t,u,r,e,\\,r,\\,n,\\,r,\\,n,C,+,+,\\,r,\\,n", "image_url": "http://m3.licdn.com/mpr/pub/image-0WglTCMcAxljLDuquqGUlnKTF-UrHeGtpWgbc2jcFD0PHV680WgbzZdcFan6H5rrHqMD/brendan-burns.jpg", "Location": {"country": "AU", "state": "VIC", "city": "Port Melbourne"}, "Recommendations": "4", "profile_url": "https://www.linkedin.com/reg/join-pprofile?_ed=0_dHB8G4tKSI1eNkyEd3uBk2dzQE2AkVU1r9kHbXjxPZGWJlD5Jt4ZMf87SacJnJbVC1GHBtsbr-SVajLD-pJHkm7wg4Zmae_CGfZoa_2-8EY&trk=pprof-0-ts-view_full-0"}