{"Jobs": [], "Name": {"middle": "", "last": "Maharaj", "First": "Moonesh"}, "summary": "", "Connections": "4", "specialties": "", "image_url": "", "Location": {"country": "US", "state": "FL", "city": "Tampa"}, "Recommendations": "", "profile_url": "https://www.linkedin.com/reg/join-pprofile?_ed=0_dHB8G4tKSI1eNkyEd3uBk2dzQE2AkVU1r9kHbXjxPZGWJlD5Jt4ZMf87SacJnJbVIxQ-Dvn1iwKLW6k1uBKeFomYM2ixA1VeLP-l-VJAN-s&trk=pprof-0-ts-view_full-0"}