{"Jobs": [], "Name": {"middle": "", "last": "Turdikulov", "First": "Azamat"}, "summary": "", "Connections": "1", "specialties": "", "image_url": "", "Location": {"country": "DE", "state": "NDS", "city": "BS"}, "Recommendations": "", "profile_url": "https://www.linkedin.com/reg/join-pprofile?_ed=0_dHB8G4tKSI1eNkyEd3uBk2dzQE2AkVU1r9kHbXjxPZGWJlD5Jt4ZMf87SacJnJbVKOrskhscsc-_KRnip9Ah9i1yiZjVhkjTZBed8ze3xe9&trk=pprof-0-ts-view_full-0"}