{"Jobs": [{"company": "ING", "title": "building block architect for trade finance and bank guarantees", "description": "', '    working on IT strategy and roadmap', '", "end_date": "", "start_date": "July 2012"}], "Name": {"middle": "", "last": "Coenen", "First": "Jan"}, "summary": "', '    Working for the department of Enterprise Architecture at ING.', '', 'Focus on trade finance and bank guarantees.', 'Before this working as information architect and consultant for ING Banking. Specialized in IT solutions for \"savings\" & \"loans\". Interested in topics as, information strategy including e.g. application assessments, outsourcing etc.', 'Not only in this business for the money, but after office hours working as an artist (painting, drawing) on a professional level (see WWW.JanCoenen.NL).', '", "Connections": "174", "specialties": "\\,r,\\,n,B,u,s,i,n,e,s,s,A,r,c,h,i,t,e,c,t,u,r,e,\\,r,\\,n,\\,r,\\,n,I,n,f,o,r,m,a,t,i,o,n,A,r,c,h,i,t,e,c,t,u,r,e,\\,r,\\,n,\\,r,\\,n,T,e,c,h,n,o,l,o,g,y,P,l,a,n,n,i,n,g,\\,r,\\,n,\\,r,\\,n,I,n,f,o,r,m,a,t,i,o,n,A,n,a,l,y,s,i,s,\\,r,\\,n,\\,r,\\,n,F,i,n,e,A,r,t,\\,r,\\,n,\\,r,\\,n,I,n,f,o,r,m,a,t,i,o,n,M,a,n,a,g,e,m,e,n,t,\\,r,\\,n,\\,r,\\,n,I,C,T,\\,r,\\,n,\\,r,\\,n,P,r,o,c,e,s,s,M,a,n,a,g,e,m,e,n,t,\\,r,\\,n,\\,r,\\,n,P,R,I,N,C,E,2,\\,r,\\,n,\\,r,\\,n,B,u,s,i,n,e,s,s,A,n,a,l,y,s,i,s,\\,r,\\,n,\\,r,\\,n,E,n,t,e,r,p,r,i,s,e,A,r,c,h,i,t,e,c,t,u,r,e,\\,r,\\,n,\\,r,\\,n,F,u,n,c,t,i,o,n,a,l,D,e,s,i,g,n,\\,r,\\,n,\\,r,\\,n,T,O,G,A,F,\\,r,\\,n,\\,r,\\,n,P,h,o,t,o,s,h,o,p,\\,r,\\,n", "image_url": "", "Location": {"country": "NL", "state": "FL", "city": "Almere"}, "Recommendations": "", "profile_url": "https://www.linkedin.com/reg/join-pprofile?_ed=0_dHB8G4tKSI1eNkyEd3uBk2dzQE2AkVU1r9kHbXjxPZGWJlD5Jt4ZMf87SacJnJbVBJaA4hPQY5ATH2WeRSrwSEAGznQ42FlR_q05mU-Pw5c&trk=pprof-0-ts-view_full-0"}