{"Jobs": [{"company": "Oracle Corporation", "title": "Senior Recruiter - EMEA Recruitment Team", "description": "', '    Currently focused on the UK&I and Western European organisations, recruiting into the Consulting and Development lines of business, hiring high potential Consultants and Architects with SOA, E2.0, Cloud and IDM skills and Developers and Testers with J2EE and Solaris specialist skills.', '', 'I also drive the recruitment for our very successful MySQL, Virtualisation and Linux Sales Consulting Global Business Unit, hiring talented Enterprise Sales Execs and Managers.', '", "end_date": "", "start_date": "March 2011"}, {"company": "IT Executive Ltd", "title": "Senior Associate", "description": "', '    A founder member of IT Executive Ltd which has been operating throughout the UK and Europe since 1998 as a specialist IT & Telecoms recruitment consultancy. ', '', 'Clients varied from start-ups to large corporates but regardless of size, I created bespoke solutions to meet their individual needs. Expertise covered contingency recruitment through database search and advertised selection, along with contingency search or one off retained assignment services for higher profile hiring needs.', '", "end_date": "March 2011", "start_date": "May 2010"}, {"company": "Hays Telecoms Ltd", "title": "Senior Consultant", "description": "', '    Contract & permanent recruitment within Telecoms Operations and Mobile/Wireless verticals.', '', 'Successfully turned around a failing contract PSL Account (Alcatel-Lucent), significantly improving both delivery within business critical programmes and the Hays profile amongst hiring managers and contractors.', '", "end_date": "March 2010", "start_date": "January 2009"}, {"company": "IT Executive Ltd", "title": "Business Development Manager", "description": "', '    Approached to join the owner in the start-up phase of the business. A 360 role as well as involvement in hiring and mentoring other Consultants.', '', 'Developed long term relationships with blue-chip and SME clients throughout the UK IT sector.', '", "end_date": "January 2009", "start_date": "December 1998"}, {"company": "Hays IT Ltd", "title": "Principal Consultant", "description": "', '    Promoted from Trainee to Principal Consultant within 12 months. Billed the highest permanent fees across the UK and European IT Divisions during 1997-1998 financial year.', '", "end_date": "1998", "start_date": "1996"}], "Name": {"middle": "", "last": "Carter", "First": "Simon"}, "summary": "', '    With 15 years external IT&T recruitment experience, I now work for Oracle as a Senior Recruiter across the Consulting, Sales Consulting, Development and Support lines of business, throughout Europe, Middle East & Africa. ', '', 'Why Oracle?....we provide the world\u2019s most complete, open, and integrated business software and hardware systems, with more than 370,000 customers\u2014including 100 of the Fortune 100\u2014representing a variety of sizes and industries in more than 145 countries around the globe. Now, with Sun server, storage, operating-system, and virtualization technology, Oracle is the only vendor able to offer a complete technology stack in which every layer is integrated to work together as a single system.', '', \"Starting more than 30 years ago with Oracle's innovative relational database, the Oracle stack today includes Oracle Enterprise Linux, Oracle VM, Oracle Fusion Middleware, and the largest and most complete set of industry and business applications software on the market. The addition of Sun storage and systems technology makes the Oracle stack complete.\", '', 'Oracle employees enjoy competitive salaries, an excellent flexible benefits scheme and a network of like-minded co-workers that drive innovation across the entire technology industry. Working at Oracle means working on innovative, leading technological developments. Do you want to become part of this? Then go to: http://emeajobs.oracle.com', '', 'All direct candidate queries regarding career opportunities at Oracle are welcome. Do not hesitate to contact me directly for an informal discussion - simon.carter@oracle.com', '", "Connections": "500+", "specialties": "\\,r,\\,n,R,e,c,r,u,i,t,i,n,g,\\,r,\\,n,\\,r,\\,n,A,c,c,o,u,n,t,M,a,n,a,g,e,m,e,n,t,\\,r,\\,n,\\,r,\\,n,B,u,s,i,n,e,s,s,D,e,v,e,l,o,p,m,e,n,t,\\,r,\\,n,\\,r,\\,n,T,e,c,h,n,i,c,a,l,R,e,c,r,u,i,t,i,n,g,\\,r,\\,n,\\,r,\\,n,E,x,e,c,u,t,i,v,e,S,e,a,r,c,h,\\,r,\\,n,\\,r,\\,n,B,e,n,e,f,i,t,s,N,e,g,o,t,i,a,t,i,o,n,\\,r,\\,n,\\,r,\\,n,T,a,l,e,n,t,A,c,q,u,i,s,i,t,i,o,n,\\,r,\\,n,\\,r,\\,n,S,o,u,r,c,i,n,g,\\,r,\\,n,\\,r,\\,n,C,o,n,t,r,a,c,t,R,e,c,r,u,i,t,m,e,n,t,\\,r,\\,n,\\,r,\\,n,I,n,t,e,r,n,e,t,R,e,c,r,u,i,t,i,n,g,\\,r,\\,n,\\,r,\\,n,S,c,r,e,e,n,i,n,g,R,e,s,u,m,e,s,\\,r,\\,n,\\,r,\\,n,T,a,l,e,n,t,M,a,n,a,g,e,m,e,n,t,\\,r,\\,n", "image_url": "http://m3.licdn.com/mpr/pub/image-uq6WM7Dm2P9oSCrP3AMrdnABpiJVvC4WAlMCYwAf0KJsnh4fal90K7APQ1JV_U-XkN/simon-carter.jpg", "Location": {"country": "GB", "state": "England", "city": "London"}, "Recommendations": "1", "profile_url": "https://www.linkedin.com/reg/join-pprofile?_ed=0_dHB8G4tKSI1eNkyEd3uBk2dzQE2AkVU1r9kHbXjxPZGWJlD5Jt4ZMf87SacJnJbVI62m9RF67DxRQo85-stcZgjv00GIN023_7Tu3MlL6kx&trk=pprof-0-ts-view_full-0"}