{"Jobs": [{"company": "Pyramid-4", "title": "Independent Contract / Consult", "description": "", "end_date": "", "start_date": "March 1997"}, {"company": "Client:  Anchor Glass Container Corp.", "title": "EDI Specialist", "description": "", "end_date": "March 2012", "start_date": "October 2011"}, {"company": "Client: S&D Coffee, Concord, NC", "title": "EDI Programmer Analyst (Gentran for i-Series v4.0 / JD Edwards v7.3)", "description": "", "end_date": "March 2012", "start_date": "August 2007"}, {"company": "Liberty Hardware", "title": "EDI Specialist", "description": "", "end_date": "August 2011", "start_date": "May 2010"}, {"company": "Client: W.L. Gore", "title": "EDI Team Lead; Programmer Analyst (Inovis (Harbinger v2.11) / JD Edwards v7.3)", "description": "", "end_date": "August 2008", "start_date": "September 2006"}, {"company": "Client: Corning Cable Systems, Hickory, NC", "title": "EDI Analyst / Mapper (Gentran / SAP)", "description": "", "end_date": "September 2006", "start_date": "March 2006"}, {"company": "Client: Husqvarna Forest & Garden, Charlotte, NC", "title": "EDI Team Lead; Programmer Analyst (Extol / REX)", "description": "", "end_date": "December 2005", "start_date": "July 2004"}, {"company": "Client: S&D Coffee, Concord, NC", "title": "JD Edwards Programmer Analyst; Gentran EDI consult", "description": "", "end_date": "February 2004", "start_date": "March 2003"}, {"company": "Client: W.L. Gore, Newark, DE", "title": "EDI Programmer Analyst (Inovis (Harbinger v2.11) / JD Edwards v7.3)", "description": "", "end_date": "January 2003", "start_date": "April 2001"}, {"company": "Client: Regent Lighting / Cooper Lighting", "title": "EDI Project Lead; Programmer Analyst (Harbinger / JD Edwards v7.3)", "description": "", "end_date": "January 2001", "start_date": "September 1999"}, {"company": "Client: Valdese Weavers", "title": "EDI Project Lead; Programmer Analyst (SAP EDI)", "description": "", "end_date": "July 1999", "start_date": "January 1999"}, {"company": "Client: Century Furniture, Hickory, NC", "title": "EDI Project Lead; Programmer Analyst (SAP EDI)", "description": "", "end_date": "July 1999", "start_date": "March 1997"}], "Name": {"middle": "", "last": "Santon", "First": "Germaine"}, "summary": "', '    EXPERIENCE:', '', 'AS400 / i-Series:  RPG / COBOL:  EDI:  JD Edwards (Oracle) ', 'Implementations / Conversions / Integration / Design / Programming / Testing / Documentation / User Training', '', 'EDI translators / AS2: ', 'NuBridges Trailblazer, now Liaison Technologies', 'Sterling Gentran  ', 'Inovis (a.k.a. Premenos, Harbinger Trusted Link, Peregrine)', 'SAP IDOC (EDI mapping ONLY with both Gentran and Inovis)', 'EXTOL: certified 2003 ', '', 'EDUCATION: ', 'UNC-Charlotte:  Bachelor of Science, Computer Science', 'Youngstown State Univ:  Associate in Applied Science, Computer Technology  ', 'UNC-Charlotte:  Project Management Curriculum  2010', 'UNC-Charlotte:  Business Analysis Certification course work  2009 ', 'EDI exposure to PKMS WMS  2010', 'Exposure to C#, Visual Studio (dot.net)  2009', '", "Connections": "62", "specialties": "\\,r,\\,n,O,r,a,c,l,e,O,W,v,7,.,3,(,O,M,W,/,v,e,r,s,i,o,n,s,/,n,a,v,i,g,a,t,i,o,n,),\\,r,\\,n,\\,r,\\,n,R,P,G,\\,r,\\,n,\\,r,\\,n,E,D,I,\\,r,\\,n,\\,r,\\,n,J,D,E,d,w,a,r,d,s,\\,r,\\,n,\\,r,\\,n,I,n,t,e,g,r,a,t,i,o,n,\\,r,\\,n,\\,r,\\,n,P,r,o,g,r,a,m,m,i,n,g,\\,r,\\,n,\\,r,\\,n,C,O,B,O,L,\\,r,\\,n,\\,r,\\,n,I,B,M,i,S,e,r,i,e,s,\\,r,\\,n,\\,r,\\,n,E,R,P,\\,r,\\,n,\\,r,\\,n,O,r,a,c,l,e,\\,r,\\,n,\\,r,\\,n,S,y,s,t,e,m,s,A,n,a,l,y,s,i,s,\\,r,\\,n,\\,r,\\,n,I,T,M,a,n,a,g,e,m,e,n,t,\\,r,\\,n", "image_url": "http://m3.licdn.com/mpr/pub/image-Btk4lZSdpsRp6mGKkhxVTRwIXxCJL2HxXWxxWNUgX1L6M0hHBtkxWpkdXix5K8_ITKSj/germaine-santon.jpg", "Location": {"country": "US", "state": "NC", "city": "Charlotte"}, "Recommendations": "7", "profile_url": "https://www.linkedin.com/reg/join-pprofile?_ed=0_dHB8G4tKSI1eNkyEd3uBk2dzQE2AkVU1r9kHbXjxPZGWJlD5Jt4ZMf87SacJnJbVIOet2Lv3OFcTxSkChs9ZMer2U06fKT7iqOEM3Ssc61N&trk=pprof-0-ts-view_full-0"}