{"Jobs": [], "Name": {"middle": "", "last": "afhdfgfgd", "First": "dasdasd"}, "summary": "", "Connections": "1", "specialties": "", "image_url": "", "Location": {"country": "US", "state": "NY", "city": "Albany"}, "Recommendations": "", "profile_url": "https://www.linkedin.com/reg/join-pprofile?_ed=0_dHB8G4tKSI1eNkyEd3uBk2dzQE2AkVU1r9kHbXjxPZGWJlD5Jt4ZMf87SacJnJbVwuONBMUdY03iqaC4YdA3mgBFtfZ6ig-H6gBxGwXWJH6&trk=pprof-0-ts-view_full-0"}