{"Jobs": [], "Name": {"middle": "", "last": "Ds", "First": "Johnson"}, "summary": "", "Connections": "1", "specialties": "", "image_url": "", "Location": {"country": "US", "state": "VA", "city": "Roanoke"}, "Recommendations": "", "profile_url": "https://www.linkedin.com/reg/join-pprofile?_ed=0_dHB8G4tKSI1eNkyEd3uBk2dzQE2AkVU1r9kHbXjxPZGWJlD5Jt4ZMf87SacJnJbVBEhyI87Loxg68EiCjx-kQK4YBLdEaSpnuygb7mU978r&trk=pprof-0-ts-view_full-0"}