{"Jobs": [], "Name": {"middle": "", "last": "Lynch", "First": "Carol"}, "summary": "", "Connections": "1", "specialties": "", "image_url": "", "Location": {"country": "US", "state": "VA", "city": "Norfolk"}, "Recommendations": "", "profile_url": "https://www.linkedin.com/reg/join-pprofile?_ed=0_dHB8G4tKSI1eNkyEd3uBk2dzQE2AkVU1r9kHbXjxPZGWJlD5Jt4ZMf87SacJnJbVz_u2H9DIM7eQRgNLpEteqrJe5uBSr4tBQ9cZE4ZAiwr&trk=pprof-0-ts-view_full-0"}