{"Jobs": [], "Name": {"middle": "", "last": "Bert", "First": "Quick"}, "summary": "", "Connections": "1", "specialties": "", "image_url": "", "Location": {"country": "US", "state": "MA", "city": "Marshfield"}, "Recommendations": "", "profile_url": "https://www.linkedin.com/reg/join-pprofile?_ed=0_dHB8G4tKSI1eNkyEd3uBk2dzQE2AkVU1r9kHbXjxPZGWJlD5Jt4ZMf87SacJnJbVLdN7XkvMXjEjjwQTIorj6isdIazxeNMBhvz6dDxG9bG&trk=pprof-0-ts-view_full-0"}