{"Jobs": [{"company": "Schock Design", "title": "Owner", "description": "', 'Schock Design helps companies design and develop simple, easy, successful Web software at all points of the process, from concept to launch.', '", "end_date": "", "start_date": "January 1997"}, {"company": "Savings.com", "title": "User Interface Engineer", "description": "', 'Working with other stakeholders to create fast, compelling user experiences for highly-trafficked deals Web site. Specialist in client-side technologies, including HTML, CSS, YUI, jQuery, Backbone.js, Java, Velocity; resident Git expert; UX and paper prototyping; agile methodologies.', '', 'Helped lead an intense, month-long project to design and implement a new company-changing personalization product. Roles included product development, engineering, UX, and project management. Delivered what we promised, and on time.', '", "end_date": "August 2011", "start_date": "March 2010"}, {"company": "Applied Minds", "title": "User Interface Engineer", "description": "', 'Responsible for all user interface design and development for video sharing Web application. Led concept development and paper prototyping with team. Wrote clean XHTML, utilized frameworks like YUI and jQuery, and dazzled eyes with CSS. Using AJAX and JSON elements, and modern optimization techniques -- like compression, caching and minification -- created a speedy, responsive user experience.', '", "end_date": "November 2009", "start_date": "January 2009"}, {"company": "Layout Solutions, Inc", "title": "Web Development Director", "description": "', 'Overseeing and executing all aspects of Web application development for clients, from initial consulting to launch. XP-style requirements gathering, paper prototyping, user experience design, Rails development, server management, application deployment.', '", "end_date": "December 2008", "start_date": "January 2008"}, {"company": "Procore Technologies, Inc.", "title": "Contract Web Developer", "description": "', 'Provided design and development services for their core product.', '", "end_date": "February 2007", "start_date": "December 2006"}, {"company": "Below the Line Magazine", "title": "Online Manager", "description": "', \"- Designed/developed the magazine's Web presence\", '- Designed/developed several robust Web applications to supplement their print publication, supporting several thousand users.', '- Managed & configured Web servers and technology', '", "end_date": "November 2006", "start_date": "July 2001"}, {"company": "Jason Schock Photography", "title": "Owner", "description": "', 'Specializing in editorial and sports.', '", "end_date": "2006", "start_date": "August 1998"}, {"company": "Fastclick", "title": "Software Engineer/ UI Designer", "description": "', '- Initiated, designed, & developed an application (called CHIMP) to improve internal communication & workflow', '- Designed the user interface for a skunk-works search advertising software project', '", "end_date": "September 2005", "start_date": "May 2004"}, {"company": "Benefit Software, Inc.", "title": "Web Developer", "description": "', 'Developed Web-based employee benefits software.', '", "end_date": "October 2003", "start_date": "June 2003"}, {"company": "Fionda, LLC", "title": "Contract Web Developer", "description": "', 'Worked on database-intensive Web application for managing over a million telecommunications customer records and related metrics.', '", "end_date": "June 2003", "start_date": "May 2003"}, {"company": "University of California, Santa Barbara", "title": "Web Designer/Developer", "description": "', 'Initiated, oversaw, designed and developed the redesign of the Admissions and Outreach Web site, improving information accessibility. Designed and developed custom Web applications for staff and public', '", "end_date": "August 2002", "start_date": "June 2001"}, {"company": "UCSB Daily Nexus", "title": "Online Editor", "description": "', 'Initiated, designed, and developed a database-driven, community-based Web site for the student daily newspaper. Responsible for all online content. Trained junior Web team members.', '", "end_date": "June 2001", "start_date": "August 2000"}, {"company": "UCSB Daily Nexus", "title": "Photo Editor", "description": "', 'Responsible for all daily photo content at student paper: editing, giving out assignments to junior photographers, production. Also handled numerous daily photo assignments, as well as departmental purchasing and payroll.', '", "end_date": "December 2000", "start_date": "November 1998"}, {"company": "North County Times", "title": "ISP Support Technician", "description": "', \"Provided phone support to customers of the newspaper's dial-up Internet service.\", '", "end_date": "August 1998", "start_date": "January 1998"}], "Name": {"middle": "", "last": "Schock", "First": "Jason"}, "summary": "', 'Broadly experienced Web ninja who produces creative, polished, professional Web-based products with high attention to detail. Hands-on knowledge of everything it takes to get a Web project online, from design to deployment. Deep understanding of how to design products that customers find easy to use.', '', \"I've worked for a variety of companies over the years; startup atmosphere is preferred.\", '", "Connections": "168", "specialties": "\\,r,\\,n,U,s,e,r,E,x,p,e,r,i,e,n,c,e,\\,r,\\,n,\\,r,\\,n,I,n,t,e,r,a,c,t,i,o,n,D,e,s,i,g,n,\\,r,\\,n,\\,r,\\,n,U,s,a,b,i,l,i,t,y,\\,r,\\,n,\\,r,\\,n,U,s,e,r,I,n,t,e,r,f,a,c,e,D,e,s,i,g,n,\\,r,\\,n,\\,r,\\,n,U,s,e,r,I,n,t,e,r,f,a,c,e,\\,r,\\,n,\\,r,\\,n,I,n,f,o,r,m,a,t,i,o,n,A,r,c,h,i,t,e,c,t,u,r,e,\\,r,\\,n,\\,r,\\,n,j,Q,u,e,r,y,\\,r,\\,n,\\,r,\\,n,H,T,M,L,\\,r,\\,n,\\,r,\\,n,C,S,S,\\,r,\\,n,\\,r,\\,n,R,u,b,y,o,n,R,a,i,l,s,\\,r,\\,n,\\,r,\\,n,S,E,O,\\,r,\\,n,\\,r,\\,n,S,E,M,\\,r,\\,n,\\,r,\\,n,U,s,e,r,E,x,p,e,r,i,e,n,c,e,\\,r,\\,n,\\,r,\\,n,O,n,l,i,n,e,A,d,v,e,r,t,i,s,i,n,g,\\,r,\\,n,\\,r,\\,n,W,e,b,A,n,a,l,y,t,i,c,s,\\,r,\\,n", "image_url": "http://m3.licdn.com/mpr/pub/image-VFPvOu7vUvn8tSN8iQVKjOsVW3jTniKmoFHHxuhXWqRaU1zqVFPHifOvWblQUKjkJ9lf/jason-schock.jpg", "Location": {"country": "US", "state": "CA", "city": "Irvine"}, "Recommendations": "2", "profile_url": "https://www.linkedin.com/reg/join-pprofile?_ed=0_dHB8G4tKSI1eNkyEd3uBk2dzQE2AkVU1r9kHbXjxPZGWJlD5Jt4ZMf87SacJnJbVFtZIVm9KAyXzk6wUF2QMcA92hLp9D_qOeK2qB0dkpKh&trk=pprof-0-ts-view_full-0"}